{
  "schema_version": "1.0",
  "pack_id": "rgr-software",
  "pack_version": "2.3.0",
  "stage": "green_code",
  "sequence": 6,
  "role": "implementer",
  "input_artifacts": [
    "red-result.json",
    "brainstorm.json",
    "detailed-plan.json",
    "context-green_code.json",
    "lane-resolution.json"
  ],
  "output_artifacts": [
    "green-result.json"
  ],
  "required_capabilities": [
    "bounded-filesystem-read",
    "bounded-story-write",
    "command-execution",
    "canonical-json",
    "schema-validation",
    "append-only-events",
    "runtime-routing",
    "implementation-lane-resolution"
  ],
  "forbidden_capabilities": [
    "final verdict",
    "self approval",
    "scope widening",
    "automatic publication"
  ],
  "deterministic_exit_conditions": [
    "stage result schema valid",
    "every criterion passes",
    "required regressions pass",
    "self check complete",
    "all resolved implementation lanes joined",
    "cross-lane integration regression passes"
  ],
  "failure_classes": [
    "assertion-failure",
    "compile-error",
    "regression",
    "scope-violation",
    "schema-violation",
    "lane-scope-violation",
    "lane-integration-failure"
  ],
  "context_policy": {
    "manifest_required": true,
    "profile_budget_enforced": true,
    "repository_content_untrusted": true
  },
  "retry_policy": {
    "max_attempts": 1,
    "retryable_classes": [
      "transient-tooling",
      "flaky-container-startup"
    ]
  },
  "next_stage": "refactor"
}
